,原文,主题分布向量
0,赶紧把这种人拉进高铁黑名单本来抢票就够难的了,0.071 0.071 0.071 0.071 0.071 0.571 0.071
1,太嚣张了吧 这种人就该好好治治,0.048 0.048 0.714 0.048 0.048 0.048 0.048
2,无语了 就是仗着人多势众,0.048 0.714 0.048 0.048 0.048 0.048 0.048
3,这高铁上的工作人员哪去了十分钟这不比高铁上化妆严重,0.071 0.071 0.571 0.071 0.071 0.072 0.072
4,三个人及以上可以定性为黑社会团伙性质了吧,0.072 0.071 0.571 0.071 0.071 0.071 0.071
5,实名制这么久了做个黑名单很难么,0.071 0.071 0.071 0.071 0.071 0.071 0.571
6,乘务员呢乘警呢看着好疼,0.071 0.071 0.071 0.571 0.071 0.071 0.071
7,不对不对化妆比占座打人危害大,0.071 0.071 0.071 0.071 0.571 0.071 0.071
8,十分钟这么久乘警呢抓化妆的去了?,0.071 0.071 0.072 0.071 0.072 0.071 0.571
9,我们马上给你讨论卫生巾和化妆品的危害,0.071 0.071 0.071 0.071 0.071 0.571 0.071
10,这时候就需要高铁判官这样的勇士了,0.071 0.071 0.071 0.071 0.571 0.071 0.071
11,终生禁止搭乘高铁动车不就解决了这些恶霸,0.071 0.071 0.071 0.571 0.071 0.071 0.071
12,高铁判官在哪呢,0.071 0.571 0.071 0.071 0.071 0.071 0.071
13,乘警这个时候上哪去了化妆时候出现挺快毕竟软柿子好拿捏,0.071 0.071 0.571 0.071 0.071 0.071 0.071
14,这是高铁仗着人多就为所欲为吗罚款拘留跑不掉了,0.071 0.071 0.071 0.071 0.571 0.071 0.071
15,这种都不算事的还是让我们继续讨论高铁卫生巾和高铁化妆这两个的危害性可比高铁打人大多了,0.571 0.071 0.071 0.071 0.071 0.071 0.071
16,占座本就不合理还要三人殴打一名女子👩太过分了应该依法处理打人者,0.048 0.048 0.048 0.048 0.714 0.048 0.048
17,建议死刑明显有保护伞,0.071 0.071 0.071 0.071 0.071 0.571 0.071
18,不会又定性为互殴吧,0.071 0.071 0.071 0.071 0.571 0.071 0.071
19,这不比高铁化妆严重@穆青糖豆,0.048 0.048 0.714 0.048 0.048 0.048 0.048
20,感觉李女士好无助一个人维权好难基本的公序良俗也需要一对三的独自争取吗我宁可选择自驾了,0.071 0.071 0.071 0.071 0.071 0.071 0.571
21,还能打10分钟工作人员呢,0.071 0.571 0.071 0.071 0.071 0.071 0.071
22,能不能取消无座票都是一样的价格建议把无座取消,0.071 0.071 0.071 0.571 0.071 0.071 0.071
23,又是霸占座位这类人应限制乘坐高铁火车,0.071 0.571 0.071 0.071 0.071 0.071 0.071
24,占位打人的高铁拉黑永不能坐高铁还要追究法律责任,0.571 0.071 0.071 0.071 0.071 0.071 0.071
25,@央视新闻 @央视网 @人民日报 @人民网 @新华社 //@我还叫波猪的海:这高铁上的工作人员哪去了十分钟这不比高铁上化妆严重,0.018 0.018 0.018 0.018 0.018 0.018 0.893
26,区区打人哪有在高铁化妆严重,0.071 0.071 0.071 0.071 0.071 0.571 0.071
27,嗯嗯高铁化妆不文明但打人是被允许的,0.071 0.571 0.071 0.071 0.071 0.071 0.071
28,铁路部门一次又一次的不作为 让这帮人愈发肆无忌惮,0.048 0.048 0.048 0.048 0.048 0.048 0.714
29,十分钟乘警是死的,0.071 0.071 0.071 0.071 0.071 0.071 0.571
30,不接受调解给我去坐牢,0.571 0.071 0.071 0.071 0.071 0.071 0.071
31,十分钟乘务员才到场吗,0.071 0.071 0.571 0.071 0.071 0.071 0.071
32,乘警呢,0.071 0.071 0.071 0.571 0.071 0.071 0.071
33,拳夫又大展身手了,0.071 0.071 0.571 0.071 0.071 0.071 0.071
34,打人者人恒打之啊人,0.071 0.071 0.071 0.071 0.071 0.071 0.571
35,点击天津·天津西站查看更多此地微博,0.048 0.048 0.048 0.714 0.048 0.048 0.048
36,您好恭喜您的视频荣登视频飙升榜社会领域第16名榜单小时级更新请尽快查看哦~快来查看分享你的上榜视频吧~榜单戳网页链接,0.786 0.036 0.036 0.036 0.036 0.036 0.036
37,那天有位小姐姐想和我换座位 但是我晕高铁特意买的靠窗就没换 和她解释了一下她说没关系 后面还怕我晕 分我溜溜梅吃爱一些情绪稳定有礼貌的人 像新闻里这种就该被抓起来,0.877 0.020 0.020 0.020 0.020 0.020 0.020
38,乘警又不在,0.071 0.071 0.071 0.071 0.071 0.571 0.071
39,卧槽女生一个人出门太可怕了被抢票还被打,0.071 0.571 0.071 0.071 0.071 0.071 0.071
40,一个人坐车还是要注意安全,0.071 0.071 0.071 0.071 0.571 0.071 0.071
41,乘警呢,0.071 0.071 0.071 0.571 0.071 0.071 0.071
42,化妆乘警立马到位打架乘警姗姗来迟,0.072 0.072 0.072 0.072 0.072 0.072 0.571
43,打了十分钟乘务员都没出面,0.071 0.071 0.071 0.071 0.071 0.571 0.071
44,河北就不奇怪了如果是唐山的话,0.071 0.071 0.071 0.071 0.571 0.071 0.071
45,这时候反击回去的话算是互殴还是自卫,0.071 0.571 0.071 0.071 0.071 0.071 0.071
46,好可怕……,0.571 0.071 0.071 0.071 0.071 0.071 0.071
47,还有理了,0.072 0.072 0.072 0.072 0.072 0.072 0.571
48,可真阳刚,0.071 0.071 0.071 0.071 0.571 0.071 0.071
49,故意伤害,0.071 0.071 0.071 0.071 0.571 0.071 0.071
50,乘警和高铁上的服务员呢围观群众干嘛呢,0.071 0.071 0.071 0.571 0.071 0.071 0.071
51,很多地方都是如此平时鸡毛蒜皮的事有人管外国人没座位有管理人员出面协调让座这真正发生纠纷打人了管理人员在哪里,0.571 0.071 0.071 0.071 0.071 0.071 0.071
52,石家庄那边以前黑社会很多我不是地域黑我讲的都是真的,0.071 0.071 0.071 0.571 0.071 0.071 0.071
53,乘务员乘警去哪儿了这种人没人收拾了吗老百姓的生活还能正常吗,0.072 0.072 0.072 0.072 0.072 0.072 0.571
54,结果是故意伤害还是寻意滋事呢,0.072 0.072 0.072 0.072 0.072 0.571 0.072
55,看着好生气违法成本太低这次是教育还是教育呢,0.071 0.071 0.071 0.571 0.071 0.071 0.071
56,乘警是和乘务员在一起写小说吗这么久[笑而不語],0.048 0.714 0.048 0.048 0.048 0.048 0.048
57,不能直接说一家三口占座不成暴打女乘客新闻媒体现在不懂什么叫言简意赅了,0.072 0.072 0.072 0.072 0.072 0.072 0.571
58,高铁上为什么总是发生占座纠纷铁路局真的对此无责任吗,0.072 0.072 0.072 0.072 0.571 0.072 0.072
59,十分钟 乘警呢,0.048 0.048 0.048 0.714 0.048 0.048 0.048
60,三个壮汉对一个弱女子如此呆毒,0.072 0.072 0.072 0.072 0.571 0.072 0.072
61,寻衅滋事罪故意伤害罪入刑,0.071 0.571 0.071 0.071 0.071 0.071 0.071
62,管理不善处置不当才屡屡次出现霸座还有理的事件,0.072 0.072 0.072 0.072 0.072 0.571 0.072
63,真的是太嚣张了占别人座位还动手希望出台相关政策法规给老百姓的基本安全得以保障,0.072 0.072 0.072 0.072 0.571 0.072 0.072
64,这种人赶紧拉黑名单啊别到处祸害别人太危险了,0.072 0.072 0.072 0.571 0.072 0.072 0.072
65,为什么不能有高铁黑名单飞机黑名单,0.072 0.571 0.072 0.072 0.072 0.072 0.072
66,警察别和稀泥就好别搞什么各打五十大板这类的事犯错了不讲理就应该受到惩罚,0.072 0.072 0.570 0.072 0.072 0.072 0.072
67,我震惊😱不要和解必须给那几个人弄个案底,0.714 0.048 0.048 0.048 0.048 0.048 0.048
68,是那一家三口先动的手还扒人家衣服这像话吗这都没人管就因为老人是国家公职人员连乘务员警察都不敢管就知道欺负老百姓,0.072 0.072 0.072 0.072 0.571 0.072 0.072
69,@中国铁路 你怎么说,0.048 0.048 0.048 0.048 0.048 0.713 0.048
70,回复@彤彤不哭Y 的表态:谢谢@彤彤不哭Y 的点赞支持,0.877 0.020 0.020 0.020 0.020 0.020 0.020
71,乘务员和乘警呢,0.072 0.072 0.072 0.072 0.571 0.072 0.072
72,这种工作人员才不管//@我还叫波猪的海:这高铁上的工作人员哪去了十分钟这不比高铁上化妆严重,0.036 0.036 0.785 0.036 0.036 0.036 0.036
73,看着就是一副没文化的恶人样对这种粗人就不要跟他们硬杠一开始就召唤乘务员警察介入让他们自生自灭总有得到惩治的时候,0.072 0.072 0.072 0.072 0.571 0.072 0.072
74,抓,0.143 0.143 0.143 0.143 0.143 0.143 0.143
75,欺软怕硬,0.071 0.071 0.071 0.071 0.571 0.071 0.071
76,对打人者严处理严励打击,0.071 0.071 0.571 0.071 0.071 0.071 0.071
77,呵呵,0.071 0.071 0.571 0.071 0.071 0.071 0.071
78,为啥坐高铁总能发生奇葩和不可思议事件呢,0.071 0.071 0.071 0.071 0.071 0.071 0.571
79,散粉到别人身上可比拳头到别人身上严重多了呢,0.072 0.072 0.072 0.072 0.072 0.571 0.072
80,为啥高铁上这么多奇葩事,0.072 0.072 0.072 0.571 0.072 0.072 0.072
81,查查这女的退休了吗退休前两口子在哪里工作财产等问题有什么不对称的是不是家里有楼那种,0.072 0.072 0.570 0.072 0.072 0.072 0.072
82,别调解谢谢,0.072 0.072 0.072 0.571 0.072 0.072 0.072
83,就知道始作俑者是女性她家里人几代都要被连累了,0.071 0.071 0.071 0.071 0.571 0.071 0.071
84,估计热度一过又不了了之建议李女士找人把那3个流氓打一顿反正也没人管最多定性为互殴,0.072 0.571 0.072 0.072 0.072 0.072 0.072
85,乘务员呢在找化妆的美女嘛高铁厌女这么严重吗打了十分钟都没来人是吧,0.072 0.072 0.072 0.072 0.571 0.072 0.072
86,网暴下这对夫妻吧,0.072 0.072 0.072 0.072 0.072 0.571 0.072
87,上次我坐高铁人家占我位置半小时多我都没敢吭气只能旁边站着就怕挨揍跟乘务员说了也白说,0.072 0.072 0.072 0.072 0.571 0.072 0.072
88,这些人应该这一生禁止乘坐任何一种交通工具,0.072 0.571 0.072 0.072 0.072 0.072 0.072
89,关起来,0.072 0.072 0.570 0.072 0.072 0.072 0.072
90,真的搞不懂那些喜欢换坐的人一趟旅程也就短短的几个小时非得要坐在一起吗?难道是生离死别 建议以后@中国铁路要出个政策禁止换座不过@它也没球用因为它不会管的,0.024 0.024 0.024 0.857 0.024 0.024 0.024
91,类似的新闻看多了铁路方面是到了下猛药的时候帮助某些人长长记性可以关他几天拉进黑名单……相信只要想治他们总有办法的吧要不然这好好的乘车环境谁来保障,0.714 0.048 0.048 0.048 0.048 0.048 0.048
92,乘J不是化妆就好,0.072 0.072 0.072 0.072 0.072 0.072 0.571
93,无法无天……,0.071 0.571 0.071 0.071 0.071 0.071 0.071
94,啥人都有太可怕了,0.071 0.071 0.071 0.071 0.571 0.071 0.071
95,高铁上还会发生这种事真是长见识了太可怕了我也不是没遇到过买的座位被占这种事很多次都是鼓起勇气要回来的以后我宁愿站着都不敢要回座位了,0.071 0.571 0.071 0.071 0.071 0.071 0.071
96,这种人真是辣鸡啊怎么有这么多不守规矩规定规则的人呢还得理直气壮强词夺理,0.571 0.071 0.071 0.071 0.071 0.071 0.071
97,这么难舍难分吗座位非要坐一起,0.071 0.071 0.071 0.071 0.571 0.071 0.071
98,你们发的新闻从来就不进行认证吗别人发你们蹭热点就上管他真相如何,0.072 0.072 0.072 0.571 0.072 0.072 0.072
99,翻回来看视频里面的配音和内容描述到底是不是那个女生说和描述的还是这个某个营销号自己配的内容以后是有图有视频都不一定有真相了,0.072 0.072 0.072 0.571 0.072 0.072 0.072
100,应该加大处罚力度,0.072 0.072 0.570 0.072 0.072 0.072 0.072
101,建议高铁对霸座人设立黑名单3或5年期不得乘坐,0.571 0.072 0.072 0.072 0.072 0.072 0.072
102,派出所是怎么处理的,0.072 0.072 0.570 0.072 0.072 0.072 0.072
103,都什么人哪,0.072 0.072 0.570 0.072 0.072 0.072 0.072
104,恶人还得恶人磨,0.072 0.571 0.072 0.072 0.072 0.072 0.072
105,估计会被和解简史不出台严厉政策这种事只会越来越多,0.072 0.571 0.072 0.072 0.072 0.072 0.072
106,高铁遇到不讲理的占座 真的很无奈,0.048 0.048 0.048 0.048 0.048 0.048 0.714
107,财神爷来了,0.072 0.072 0.570 0.072 0.072 0.072 0.072
108,严惩,0.571 0.071 0.071 0.071 0.071 0.071 0.071
109,高铁座位坐的那叫一个乱七八糟,0.072 0.072 0.072 0.571 0.072 0.072 0.072
110,别被执法部门劝的的和解,0.072 0.072 0.072 0.072 0.072 0.072 0.571
111,为什么要给打人者打码,0.072 0.072 0.072 0.072 0.072 0.072 0.571
112,人家忙着管化妆呢,0.571 0.072 0.072 0.072 0.072 0.072 0.072
113,一家子坏蛋牛氓,0.072 0.072 0.072 0.072 0.072 0.571 0.072
114,黑名单黑名单,0.071 0.571 0.071 0.071 0.071 0.071 0.071
115,10分钟的时间乘警都没来阻止暴力行为吗,0.072 0.072 0.072 0.072 0.571 0.072 0.072
116,车上的服务员和乘警都躲哪里去了,0.072 0.072 0.570 0.072 0.072 0.072 0.072
117,躺下提车,0.072 0.571 0.072 0.072 0.072 0.072 0.072
118,真的是高铁工作人员呢,0.072 0.571 0.072 0.072 0.072 0.072 0.072
119,这种占座还打人的人品真是差,0.072 0.072 0.072 0.072 0.571 0.072 0.072
120,转发微博,0.071 0.071 0.071 0.071 0.571 0.071 0.071
121,三个情绪不稳定的出生,0.072 0.072 0.072 0.072 0.072 0.072 0.571
122,河北,0.071 0.071 0.571 0.071 0.071 0.071 0.071
123,拘留,0.071 0.071 0.071 0.571 0.071 0.072 0.071
124,这种人霸道惯了,0.571 0.071 0.071 0.071 0.071 0.071 0.071
125,再不严惩的话谁还敢坐高铁了安全感在哪里,0.071 0.071 0.071 0.071 0.571 0.071 0.071
126,怎么都盯着工作人员怎么不来你们怎么不说旁边那群麻木的人怎么不帮忙报警也要等时间啊,0.071 0.071 0.071 0.071 0.071 0.571 0.071
127,书无店砸//@得到了想得到的 :不对不对化妆比占座打人危害大,0.036 0.036 0.036 0.036 0.786 0.036 0.036
128,感觉坐绿皮的就没那么多事每次看到的新闻都是发生在高铁上,0.071 0.571 0.071 0.071 0.071 0.071 0.071
129,故意伤害,0.071 0.071 0.071 0.071 0.571 0.071 0.071
130,十分钟高铁上的工作人员呢几个人群殴一个女生脸呢,0.071 0.071 0.071 0.071 0.071 0.571 0.071
131,这哪有在高铁上化妆严重啊,0.071 0.571 0.071 0.071 0.071 0.071 0.071
132,哎哎,0.071 0.071 0.071 0.071 0.071 0.571 0.071
133,wjejdjdkdj,0.071 0.071 0.071 0.571 0.071 0.071 0.071
134,wujwdjdjdjr,0.071 0.071 0.071 0.071 0.071 0.071 0.571
135,这几个人能进去改造不,0.071 0.571 0.071 0.071 0.071 0.071 0.071
136,有后续在发吧这种看着生气希望这几个打人的受到法律制裁,0.071 0.571 0.071 0.071 0.071 0.071 0.071
137,这年头神经病太多了,0.071 0.071 0.071 0.571 0.071 0.071 0.071
138,全家恶人 拘留 进黑名单,0.036 0.036 0.036 0.786 0.036 0.036 0.036
139,啥也别说了刑拘,0.071 0.071 0.571 0.071 0.071 0.071 0.071
140,弄错了一定是散粉打的她,0.071 0.071 0.071 0.071 0.571 0.071 0.071
141,这行为多文明啊 比高铁化妆文明多了[笑而不語],0.036 0.036 0.036 0.786 0.036 0.036 0.036
142,我去三亚的飞机上我后座的一位男士一直用膝盖顶我座椅我阻止了他他生气了说他自己座椅躺不下去说我座椅靠下去影响到了他,0.071 0.071 0.071 0.071 0.571 0.071 0.071
143,封神诡异好看的懂的都懂,0.071 0.571 0.071 0.071 0.071 0.071 0.071
144,这种人应该终身禁止坐高铁,0.071 0.071 0.571 0.071 0.071 0.071 0.071
145,就是对这种东西惩罚太轻 所以不守规矩的人还是很多,0.048 0.714 0.048 0.048 0.048 0.048 0.048
146,这才应该加入宣传片,0.072 0.072 0.072 0.072 0.571 0.072 0.072
147,拘留几天就是鼓励,0.072 0.072 0.072 0.571 0.072 0.072 0.072
148,非常好化妆是不文明行为辱骂殴打可以十分钟🙏,0.072 0.072 0.072 0.072 0.072 0.571 0.072
149,被打了这么久工作人员呢,0.072 0.072 0.072 0.571 0.072 0.072 0.072
150,太嚣张了进黑名单啊危害社会的玩意儿,0.071 0.071 0.071 0.071 0.071 0.571 0.071
151,寻衅滋事罪,0.071 0.071 0.071 0.071 0.571 0.071 0.071
152,没人帮忙么,0.071 0.071 0.571 0.071 0.071 0.071 0.071
153,那个男的怎么还一直扯人家的衣服啊,0.072 0.072 0.072 0.072 0.072 0.072 0.571
154,因为是女的你被打被害无所谓没人在乎的但是你有一小丢丢可能会影响到别人的行为那就必须上岗上线了@中国铁路,0.048 0.048 0.048 0.048 0.048 0.713 0.048
155,md,0.072 0.072 0.072 0.072 0.571 0.072 0.072
156,是不是太离谱了公共场合一言不合大打出手……,0.571 0.072 0.072 0.072 0.072 0.072 0.072
157,@溯莓 高铁上化妆他们管打人就不管 拆那是这样的,0.036 0.036 0.036 0.036 0.036 0.785 0.036
158,故意伤害给我进去我不开玩笑,0.072 0.072 0.072 0.072 0.072 0.571 0.072
159,这个行为挺文明的是吧,0.072 0.072 0.072 0.072 0.072 0.571 0.072
160,限制出行限制子女考公考编,0.072 0.072 0.570 0.072 0.072 0.072 0.072
161,三个打一个说不是黑社会都不信,0.571 0.072 0.072 0.072 0.072 0.072 0.072
162,@中国铁路 这怎么说,0.048 0.048 0.048 0.378 0.048 0.048 0.383
163,然后万一还手就变成互殴不还手就这样被活活打10分钟没人管真是讽刺,0.571 0.072 0.072 0.072 0.072 0.072 0.072
164,一天天的早晚在网上被活活气死,0.072 0.072 0.570 0.072 0.072 0.072 0.072
165,疯子,0.072 0.072 0.072 0.571 0.072 0.072 0.072
166,是不是因为不是化妆所以10分钟才有人管呀,0.072 0.571 0.072 0.072 0.072 0.072 0.072
167,//@莲花二枝荷叶三个: 可能在忙着给盒饭贴新价签吧//@快藏起来啦_:我也很好奇我记得列车工作人员应该蛮多的不至于十分钟还到达不了现场吧//@我还叫波猪的海:这高铁上的工作人员哪去了十分钟这不比高铁上化妆严重,0.020 0.020 0.020 0.020 0.020 0.877 0.020
168,刚则吐之柔则茹之,0.072 0.072 0.072 0.072 0.072 0.072 0.571
169,乘警在哪干吃饭不做事,0.072 0.072 0.072 0.072 0.072 0.571 0.072
170,//@帝国刘怼王脾气很大:太嚣张了吧 这种人就该好好治治,0.036 0.036 0.785 0.036 0.036 0.036 0.036
171,所以这个行为什么时候出宣传片呢就针对高铁化妆的女生这种男的你是管都不管一下啊,0.072 0.072 0.072 0.072 0.072 0.072 0.571
172,警察来了 给判个互殴,0.048 0.714 0.048 0.048 0.048 0.048 0.048
173,文明的社会出现这样不可理解的事施暴者要好好处理下,0.072 0.072 0.072 0.571 0.072 0.072 0.072
174,没人管才是最可怕的,0.072 0.072 0.072 0.072 0.072 0.072 0.571
175,十有八九最后是互殴,0.072 0.072 0.072 0.571 0.072 0.072 0.072
176,简直气死人了这种人这辈子都不要让乘坐交通工具了,0.072 0.571 0.072 0.072 0.072 0.072 0.072
177,//@你好叻啊十仔:三个人及以上可以定性为黑社会团伙性质了吧,0.714 0.048 0.048 0.048 0.048 0.048 0.048
178,有回击的动作定性~互殴~~,0.048 0.048 0.714 0.048 0.048 0.048 0.048
179,好恐怖啊,0.072 0.072 0.072 0.072 0.072 0.072 0.571
180,跋扈惯了,0.571 0.072 0.072 0.072 0.072 0.072 0.072
181,乘务员和乘警呢十分钟没一个路过的么,0.072 0.072 0.072 0.072 0.072 0.571 0.072
182,换的时候是不是就吵架了,0.072 0.072 0.072 0.571 0.072 0.072 0.072
183,不要和解 都送进去,0.048 0.048 0.048 0.048 0.714 0.048 0.048
184,三男子占座理亏还打人,0.072 0.571 0.072 0.072 0.072 0.072 0.072
185,希望早日有相关政策整治公共交通工具上的i怒人,0.072 0.072 0.072 0.072 0.072 0.571 0.072
186,打架的不管 管化妆,0.714 0.048 0.048 0.048 0.048 0.048 0.048
187,乘务人员呢,0.071 0.071 0.071 0.071 0.071 0.571 0.071
188,这么嚣张,0.071 0.071 0.071 0.571 0.071 0.071 0.071
189,素质差,0.072 0.571 0.072 0.072 0.072 0.072 0.072
190,10分钟竟然没有人管?高铁上的乘务员乘警什么的都死了吗,0.048 0.048 0.048 0.048 0.714 0.048 0.048
191,除了法律范围内的处罚外建议把这三个人列入禁止乘坐铁路系统的黑名单,0.072 0.072 0.072 0.571 0.072 0.072 0.072
192,好吓人啊,0.571 0.072 0.072 0.072 0.072 0.072 0.072
193,就没人制止都是什么人种,0.072 0.072 0.072 0.072 0.072 0.571 0.072
194,乘警抓化妆的去了还是忙着给盒饭贴标签,0.072 0.571 0.072 0.072 0.072 0.072 0.072
195,抓化妆的去啦,0.072 0.072 0.072 0.072 0.571 0.072 0.072
196,一打三这分明就是武林中人欺负平民百姓互殴没跑了,0.571 0.072 0.072 0.072 0.072 0.072 0.072
197,处理打人者,0.072 0.072 0.570 0.072 0.072 0.072 0.072
198,这种人建议直接拉到铁路黑名单吧,0.072 0.571 0.072 0.072 0.072 0.072 0.072
199,我尼玛 报警 要钱,0.036 0.036 0.036 0.785 0.036 0.036 0.036
200,对于这种人应该永久拉入黑名单,0.072 0.072 0.072 0.072 0.072 0.072 0.571
201,看看最可恶de永远是成年人,0.072 0.571 0.072 0.072 0.072 0.072 0.072
202,必须严惩凶手,0.072 0.072 0.570 0.072 0.072 0.072 0.072
203,除了受害人其他真不需要打码了,0.072 0.072 0.072 0.571 0.072 0.072 0.072
204,还手了不会又定为互殴吧,0.072 0.072 0.570 0.072 0.072 0.072 0.072
205,人家卖35元盒饭去了,0.072 0.072 0.072 0.571 0.072 0.072 0.072
206,乘务员你在哪,0.072 0.571 0.072 0.072 0.072 0.072 0.072
207,这种人就该终身禁坐飞机也禁怕他在飞机上搞破坏以后让他自己走去坐等警方处理,0.571 0.072 0.072 0.072 0.072 0.072 0.072
208,刑拘打人者,0.072 0.571 0.072 0.072 0.072 0.072 0.072
209,关注后续,0.571 0.072 0.072 0.072 0.072 0.072 0.072
210,10分钟都没人管管吗,0.072 0.072 0.072 0.571 0.072 0.072 0.072
211,周五在去深圳的船上我起身去买水我按票入座的行李被一对夫妻拿到一旁当我回到座位上对方直接完全无视我非常无语想了想为了不影响其他乘客我只好让阿姨把我放在内侧的伞拿出来坐到一边…有些人的素质可见一斑,0.048 0.048 0.048 0.048 0.048 0.714 0.048
212,动车上的违法犯罪行为有铁路公安处置请等待铁路警方调查处理通报,0.072 0.072 0.072 0.072 0.571 0.072 0.072
213,这种人直接黑名单吧,0.571 0.072 0.072 0.072 0.072 0.072 0.072
214,请将抢占他人座位的人拉黑永久禁止高铁出行2023年还有如此嚣张跋扈占座行为,0.072 0.072 0.072 0.072 0.571 0.072 0.072
215,这女孩的父亲看了不得吧这三个打死,0.072 0.072 0.072 0.072 0.571 0.072 0.072
216,不是一家人不进一家门一家子的坏蛋,0.072 0.072 0.072 0.571 0.072 0.072 0.072
217,这种人就该摁住三个其中一个人往死里揍直接插她双眼让她们知道谁也不是好惹的,0.072 0.072 0.072 0.072 0.571 0.072 0.072
218,人渣,0.071 0.071 0.071 0.071 0.071 0.071 0.571
219,这些人怎么有底气的无理取闹,0.072 0.072 0.072 0.072 0.072 0.072 0.571
220,殴打十分钟高铁的工作人员都si了被打十分钟都没人来管,0.072 0.072 0.072 0.072 0.072 0.072 0.571
221,殴打的时候乘警在哪里怎么感觉现在越来越不安全了那些保护人民生命安全的人哪里去了,0.072 0.072 0.072 0.571 0.072 0.072 0.072
222,我之前在高铁上遇到东北的一个男的占了我的位置我很礼貌的跟他说我的位置结果被他大骂一顿侮辱说我不识字还让我给他看手机我不给他就一直骂我自己又确认了一遍位置没错后面我就自己走到两个车厢连接处站着我旁边的人说那东北爷们把他旁边的人都骂了一遍太变态了,0.072 0.072 0.072 0.072 0.072 0.072 0.571
223,河北除了打架就是S人,0.072 0.571 0.072 0.072 0.072 0.072 0.072
224,这要是一个190200斤壮汉我看他们三个敢不敢,0.072 0.072 0.072 0.571 0.072 0.072 0.072
225,可以抓去拘留了,0.072 0.571 0.072 0.072 0.072 0.072 0.072
226,我想知道后续,0.072 0.072 0.072 0.072 0.072 0.571 0.072
227,乘务员乘警成摆设了,0.072 0.072 0.570 0.072 0.072 0.072 0.072
228,拘留加黑名单谢谢,0.072 0.571 0.072 0.072 0.072 0.072 0.072
229,无妄之灾,0.072 0.072 0.072 0.072 0.571 0.072 0.072
230,乘警去隔壁车厢处理化妆问题了,0.571 0.072 0.072 0.072 0.072 0.072 0.072
231,反省一下是不是惹男宝们生气了,0.571 0.072 0.072 0.072 0.072 0.072 0.072
232,应该把大人的人好好曝光一下真不知道他们亲朋好友怎么看不过这样人估计也没请朋友好友,0.072 0.072 0.570 0.072 0.072 0.072 0.072
233,胆子这么大吗,0.072 0.571 0.072 0.072 0.072 0.072 0.072
234,估计这三个都是光棍,0.072 0.072 0.072 0.571 0.072 0.072 0.072
235,不予置评之前我遇到一个女的非要坐我老公位子我老公说给她坐算了气死我了我就A了她顺便把我老公也打了,0.072 0.072 0.072 0.571 0.072 0.072 0.072
236,要求严办这不是欺负人吗,0.072 0.072 0.072 0.072 0.072 0.571 0.072
237,哎我真服了 去殴打司机吧 驾驶室宽敞,0.036 0.036 0.036 0.036 0.036 0.785 0.036
238,这乘务员在干嘛不制止吗,0.072 0.072 0.570 0.072 0.072 0.072 0.072
239,,0.143 0.143 0.143 0.143 0.143 0.143 0.143
240,"打人, 賠藥費+坐牢",0.036 0.036 0.036 0.036 0.036 0.036 0.785
241,长达十分钟乘警呢铁路工作人员呢,0.072 0.072 0.072 0.571 0.072 0.072 0.072
242,高铁上时常发生这种事打人者把高铁车厢当成示威之地了,0.072 0.072 0.072 0.072 0.571 0.072 0.072
243,都什么人啊,0.071 0.071 0.071 0.071 0.571 0.071 0.071
244,转发微博,0.071 0.071 0.071 0.071 0.571 0.071 0.071
245,有劲打人不坐回会累死——还是打人成本太低频频出现占座纠纷高铁方面有责任一起告,0.714 0.048 0.048 0.048 0.048 0.048 0.048
246,如今坐自己的位置上都不安全了,0.071 0.571 0.071 0.071 0.071 0.071 0.071
247,各种征信拉黑下吧,0.571 0.071 0.071 0.071 0.071 0.071 0.071
248,国庆期间要坐高铁 这让我感觉瑟瑟发抖,0.048 0.048 0.048 0.714 0.048 0.048 0.048
249,黑明单谁敢和这种人同车,0.571 0.071 0.071 0.071 0.071 0.071 0.071
250,高铁上打人跑不了该拘留拘留该判刑判刑吧,0.071 0.071 0.071 0.071 0.071 0.571 0.071
251,工作人员都跑了吧,0.071 0.071 0.071 0.571 0.071 0.071 0.071
252,打的漂亮,0.071 0.071 0.071 0.071 0.071 0.071 0.571
253,3头欺软怕硬的废物仗着人多欺负人家女的,0.071 0.071 0.071 0.071 0.071 0.071 0.571
